{
  "build": "1.20.0.01",
  "version": "1.20.0",
  "channel": "release",
  "binary": {
    "linux": {
      "url": "https://www.minecraft.net/bedrockdedicatedserver/bin-linux/bedrock-server-1.20.0.01.zip",
      "sha256": "a66fdbbbcadc01494d1655ac9b57f8f91196985e8bc4e84c4fc6a6d1ad4f345e",
      "size": 86539834
    },
    "windows": {
      "url": "https://www.minecraft.net/bedrockdedicatedserver/bin-win/bedrock-server-1.20.0.01.zip",
      "sha256": "d0bc841437e4c426380621ec1fc7a8f314c2bc59f6bef126a81c83095d9600c2",
      "size": 53989790
    }
  },
  "data": {
    "language": {
      "file": "language.json.gz",
      "from": "linux"
    }
  }
}
