{
  "build": "1.26.20.5",
  "version": "1.26.20",
  "channel": "release",
  "binary": {
    "linux": {
      "url": "https://www.minecraft.net/bedrockdedicatedserver/bin-linux/bedrock-server-1.26.20.5.zip",
      "sha256": "3cad4778ce848857128269cfc4ad57bd6417beece6d857ec0df798174d01e040",
      "size": 86540632
    },
    "windows": {
      "url": "https://www.minecraft.net/bedrockdedicatedserver/bin-win/bedrock-server-1.26.20.5.zip",
      "sha256": "dc2b38857b768465717171692dec5eeb67e7fbae823ae070422405ed7de2434f",
      "size": 69020253
    }
  },
  "data": {
    "language": {
      "file": "language.json.gz",
      "from": "linux"
    }
  }
}
