{
  "build": "1.19.40.02",
  "version": "1.19.40",
  "channel": "release",
  "binary": {
    "linux": {
      "url": "https://www.minecraft.net/bedrockdedicatedserver/bin-linux/bedrock-server-1.19.40.02.zip",
      "sha256": "d0a1624305326667f706d4fbc64c2248ec7f5b4d2ea23e67364bb9a109558ea9",
      "size": 76026384
    },
    "windows": {
      "url": "https://www.minecraft.net/bedrockdedicatedserver/bin-win/bedrock-server-1.19.40.02.zip",
      "sha256": "3cd999ffbfc312e724a273f4779d968d7b4ba9618d6373b6666797e154dfe6ee",
      "size": 50416448
    }
  },
  "data": {
    "language": {
      "file": "language.json.gz",
      "from": "linux"
    }
  }
}
