{
  "build": "1.21.20.03",
  "version": "1.21.20",
  "channel": "release",
  "binary": {
    "linux": {
      "url": "https://www.minecraft.net/bedrockdedicatedserver/bin-linux/bedrock-server-1.21.20.03.zip",
      "sha256": "bef26b40342fb06147a5a37fa51724c5a8eca77052094fa26562fd771dba53d5",
      "size": 54517989
    },
    "windows": {
      "url": "https://www.minecraft.net/bedrockdedicatedserver/bin-win/bedrock-server-1.21.20.03.zip",
      "sha256": "61e688a181ab61e419f3af95d32fb641fe99eec06313c57b15dd8f24e4b78f46",
      "size": 32974388
    }
  },
  "data": {
    "language": {
      "file": "language.json.gz",
      "from": "linux"
    }
  }
}
