{
  "build": "1.17.10.04",
  "version": "1.17.10",
  "channel": "release",
  "binary": {
    "linux": {
      "url": "https://www.minecraft.net/bedrockdedicatedserver/bin-linux/bedrock-server-1.17.10.04.zip",
      "sha256": "8df929e0d12b22c5f63ffc2971a35d8bacb10d0af30a02da1ede11fb50410ac6",
      "size": 60012827
    },
    "windows": {
      "url": "https://www.minecraft.net/bedrockdedicatedserver/bin-win/bedrock-server-1.17.10.04.zip",
      "sha256": "6d1a9a3679e9e41bc0b0dd189fb97def835546365acbf19b5044e584a07e5d8e",
      "size": 40688560
    }
  },
  "data": {
    "language": {
      "file": "language.json.gz",
      "from": "linux"
    }
  }
}
